{
  "alias": "high_accuracy",
  "capabilities": {
    "allows_sensitive_data": false,
    "cost_per_1k_input_usd": 0.003,
    "cost_per_1k_output_usd": 0.015,
    "max_context_tokens": 200000,
    "max_output_tokens": 8192,
    "supports_structured_output": true,
    "supports_vision": false
  },
  "health": "degraded",
  "rejected_reason": "provider_degraded",
  "score": 0.4
}
